### ISSUE TITLE
[bug] Magic DNS / TUN 数据面会突然严重卡顿，甚至失效，重启容器后恢复

### ISSUE THREAD

**Issue by djy6257** [EasyTier/EasyTier#2193]
### 问题简要描述 / Brief Description

Magic DNS / TUN 数据面在 Docker 环境中会突然进入异常状态：`100.100.100.101` 的 DNS 查询超时，并且 `ping 100.100.100.101` 或 `ping redmi.et.net` 会出现几十秒到上百秒的异常延迟。

异常时不是单纯 DNS 配置问题，因为：

- `dig @100.100.100.101 qq.com` 超时；
- `dig @100.100.100.101 *.et.net` 超时；
- `ping 100.100.100.101` 延迟从几十秒逐步增长到 100 秒以上；
- `ping redmi.et.net` 也会出现 30s、40s、50s 级别延迟；
- EasyTier 容器 CPU / 内存很低；
- `tun0` 没有 errors/dropped；
- 重启 EasyTier 容器后立刻恢复正常。

看起来像 EasyTier 内部 TUN 数据面、Magic DNS 响应层、选路/转发队列或者 TCP tunnel 队列进入异常状态，导致数据包长时间排队或 DNS 不响应。

### 环境信息 / Environment Information

**EasyTier 版本 / EasyTier Version:**

- 受影响节点 `8250u`: EasyTier `2.6.0`
- 网络中存在其他版本节点，例如 `12600kf` 为 `2.4.5`，其他节点为 `2.6.0`
- 如有需要，我可以继续统一版本后复测

**系统环境 / System Environment:**

- OS: Ubuntu 22.04
- 运行方式: Docker
- 容器名: `1Panel-easytier-kGFb`
- DNS 管理: `systemd-resolved`
- 本机存在 `tailscale0`，但 `ip route get 100.100.100.101` 显示走 EasyTier 的 `tun0`
- 之前环境中开启过 Clash/Mihomo/防火墙规则；清理后 DNS 曾恢复，但之后 EasyTier 数据面仍会再次进入异常状态

**网络拓扑 / Network Topology:**

- 节点 `8250u`
  - 当前排查节点
  - Docker 运行 EasyTier
  - hostname: `8250u`
  - Magic DNS 查询地址: `100.100.100.101`
- 节点 `redmi`
  - Magic DNS: `redmi.et.net`
  - EasyTier IP: `10.126.126.3`
- 节点 `12600kf`
  - Magic DNS: `12600kf.et.net`
  - EasyTier IP: `10.126.126.4`
- 节点 `derp`
  - EasyTier 网络中的中继/peer 节点
- 公网 peer 地址已脱敏为 `<PUBLIC_RELAY_IP>`

**正常时 Magic DNS 解析结果:**

```text
8250u.et.net    -> 10.126.126.1
redmi.et.net    -> 10.126.126.3
12600kf.et.net  -> 10.126.126.4
```

### 节点配置 / Node Configurations

**受影响节点：8250u**

```toml
instance_name = "MyNetWork"
hostname = "8250u"
dhcp = true
rpc_portal = "127.0.0.1:15888"

listeners = [
    "tcp://0.0.0.0:11010",
    "udp://0.0.0.0:11010",
]

[network_identity]
network_name = "MyNetWork"
network_secret = "<redacted>"

[[peer]]
uri = "tcp://<PUBLIC_RELAY_IP>:11010"

[[peer]]
uri = "udp://<PUBLIC_RELAY_IP>:11010"

[flags]
accept_dns = true
bind_device = false
latency_first = true
private_mode = true
```

**host 上的 split DNS 配置:**

只希望 `*.et.net` 走 EasyTier Magic DNS，其他普通域名继续走路由器 DNS。

```bash
resolvectl dns tun0 100.100.100.101
resolvectl domain tun0 "~et.net"
resolvectl default-route tun0 false
resolvectl flush-caches
```

正常时 `resolvectl status`:

```text
Link ... (tun0)
    Current Scopes: DNS
    Protocols: -DefaultRoute +LLMNR -mDNS -DNSOverTLS DNSSEC=no/unsupported
    DNS Servers: 100.100.100.101
    DNS Domain: ~et.net
```

正常时 split DNS 验证结果:

```text
resolvectl query --cache=no --type=A 8250u.et.net
8250u.et.net IN A 10.126.126.1 -- link: tun0

resolvectl query --cache=no --type=A 12600kf.et.net
12600kf.et.net IN A 10.126.126.4 -- link: tun0

resolvectl query --cache=no --type=A qq.com
qq.com IN A 157.255.219.143 -- link: wlp2s0
```

说明 `systemd-resolved` 分流本身是可以正常工作的。

### 1. 异常状态：直接查询 Magic DNS 超时

```bash
dig @100.100.100.101 qq.com A +time=3 +tries=1 +noedns
```

输出:

```text
;; communications error to 100.100.100.101#53: timed out

; <<>> DiG 9.18.39-0ubuntu0.22.04.3-Ubuntu <<>> @100.100.100.101 qq.com A +time=3 +tries=1 +noedns
; (1 server found)
;; global options: +cmd
;; no servers could be reached
```

查询 EasyTier 节点名也超时:

```bash
dig @100.100.100.101 8250u.et.net A +time=3 +tries=1 +noedns
dig @100.100.100.101 12600kf.et.net A +time=3 +tries=1 +noedns
dig @100.100.100.101 redmi.et.net A +time=3 +tries=1 +noedns
dig @100.100.100.101 derp.et.net A +time=3 +tries=1 +noedns
```

输出均为:

```text
;; communications error to 100.100.100.101#53: timed out
;; no servers could be reached
```

### 2. 异常状态：tcpdump 能看到 DNS 请求进入 tun0，但没有回包

```bash
tcpdump -ni tun0 host 100.100.100.101 and port 53
```

输出:

```text
IP 10.126.126.5.35343 > 100.100.100.101.53: 28676+ [1au] A? 8250u.et.net. (41)
IP 10.126.126.5.35343 > 100.100.100.101.53: 28676+ [1au] A? 8250u.et.net. (41)
IP 10.126.126.5.35343 > 100.100.100.101.53: 28676+ [1au] A? 8250u.et.net. (41)
IP 10.126.126.5.35343 > 100.100.100.101.53: 28676+ A? 8250u.et.net. (30)
```

没有看到对应的:

```text
100.100.100.101.53 > 10.126.126.5.xxxxx
```

### 3. systemd-resolved 曾尝试 TCP DNS，但 100.100.100.101 不响应 TCP 53

```text
IP 10.126.126.5.46940 > 100.100.100.101.53: Flags [S]
IP 10.126.126.5.46940 > 100.100.100.101.53: Flags [S]
IP 10.126.126.5.46940 > 100.100.100.101.53: Flags [S]
```

执行下面命令后，systemd-resolved 又切回 UDP 查询:

```bash
resolvectl reset-server-features
resolvectl flush-caches
systemctl restart systemd-resolved
```

但 EasyTier 异常状态下 UDP DNS 仍然无回包。

### 4. 异常状态：TUN 数据面严重卡顿

不只是 DNS 超时，连 `ping 100.100.100.101` 都会出现几十秒到上百秒延迟:

```bash
ping 100.100.100.101
```

输出示例:

```text
64 bytes from 100.100.100.101: icmp_seq=1 ttl=64 time=23844 ms
64 bytes from 100.100.100.101: icmp_seq=2 ttl=64 time=22828 ms
64 bytes from 100.100.100.101: icmp_seq=5 ttl=64 time=34760 ms
64 bytes from 100.100.100.101: icmp_seq=10 ttl=64 time=44644 ms
64 bytes from 100.100.100.101: icmp_seq=15 ttl=64 time=54528 ms
64 bytes from 100.100.100.101: icmp_seq=25 ttl=64 time=74321 ms
64 bytes from 100.100.100.101: icmp_seq=35 ttl=64 time=94093 ms
64 bytes from 100.100.100.101: icmp_seq=44 ttl=64 time=114919 ms
```

同一时间，ping 另一个 EasyTier 节点也出现类似问题:

```bash
ping redmi.et.net
```

输出示例:

```text
PING redmi.et.net (10.126.126.3) 56(84) bytes of data.
64 bytes from 10.126.126.3: icmp_seq=1 ttl=64 time=8.73 ms
64 bytes from 10.126.126.3: icmp_seq=2 ttl=64 time=35015 ms
64 bytes from 10.126.126.3: icmp_seq=3 ttl=64 time=33999 ms
64 bytes from 10.126.126.3: icmp_seq=4 ttl=64 time=32975 ms
64 bytes from 10.126.126.3: icmp_seq=5 ttl=64 time=31947 ms
64 bytes from 10.126.126.3: icmp_seq=6 ttl=64 time=30927 ms
64 bytes from 10.126.126.3: icmp_seq=12 ttl=64 time=54792 ms
```

这些延迟看起来像包在 EasyTier 内部队列中积压，然后很晚才被释放出来。

### 5. 异常状态下资源使用正常

```bash
docker stats --no-stream 1Panel-easytier-kGFb
```

输出:

```text
CONTAINER ID   NAME                   CPU %     MEM USAGE / LIMIT     MEM %     NET I/O   BLOCK I/O     PIDS
d7abcbf43060   1Panel-easytier-kGFb   0.15%     27.78MiB / 7.662GiB   0.35%     0B / 0B   15MB / 10MB   10
```

`tun0` 没有 errors/dropped:

```bash
ip -s link show tun0
```

输出:

```text
tun0: <POINTOPOINT,UP,LOWER_UP> mtu 1360 qdisc fq_codel state UNKNOWN qlen 500

RX:
  bytes 5868
  packets 71
  errors 0
  dropped 0

TX:
  bytes 9050
  packets 81
  errors 0
  dropped 0
```

最近日志无明显 peer 断开、timeout 或 error:

```bash
docker logs --since=5m 1Panel-easytier-kGFb | grep -Ei 'peer|connection|removed|error|timeout|unreachable|relay|tcp|udp|tun|dhcp'
```

无相关输出。

### 6. 重启容器后立即恢复

```bash
docker restart 1Panel-easytier-kGFb
```

重启后 `100.100.100.101` 恢复到 0.2ms 左右:

```text
PING 100.100.100.101 (100.100.100.101) 56(84) bytes of data.
64 bytes from 100.100.100.101: icmp_seq=1 ttl=64 time=0.271 ms
64 bytes from 100.100.100.101: icmp_seq=2 ttl=64 time=0.217 ms
64 bytes from 100.100.100.101: icmp_seq=3 ttl=64 time=0.250 ms
64 bytes from 100.100.100.101: icmp_seq=4 ttl=64 time=0.215 ms
64 bytes from 100.100.100.101: icmp_seq=5 ttl=64 time=0.270 ms
```

`redmi` 节点也恢复到 4~6ms:

```text
PING 10.126.126.3 (10.126.126.3) 56(84) bytes of data.
64 bytes from 10.126.126.3: icmp_seq=1 ttl=64 time=4.09 ms
64 bytes from 10.126.126.3: icmp_seq=2 ttl=64 time=6.68 ms
64 bytes from 10.126.126.3: icmp_seq=3 ttl=64 time=6.75 ms
64 bytes from 10.126.126.3: icmp_seq=4 ttl=64 time=5.82 ms
64 bytes from 10.126.126.3: icmp_seq=5 ttl=64 time=5.19 ms
```

Magic DNS 恢复:

```bash
dig @100.100.100.101 qq.com A +time=3 +tries=1 +noedns
```

输出:

```text
;; Got answer:
;; ->>HEADER<<- opcode: QUERY, status: NOERROR
;; ANSWER SECTION:
qq.com. 481 IN A 157.255.219.143
;; SERVER: 100.100.100.101#53(100.100.100.101) (UDP)
```

查询 EasyTier 节点名也恢复:

```bash
dig @100.100.100.101 8250u.et.net A +time=3 +tries=1 +noedns
```

输出:

```text
;; Got answer:
;; ->>HEADER<<- opcode: QUERY, status: NOERROR
;; flags: qr aa rd
;; WARNING: recursion requested but not available

;; ANSWER SECTION:
8250u.et.net. 1 IN A 10.126.126.1

;; SERVER: 100.100.100.101#53(100.100.100.101) (UDP)
```

```bash
dig @100.100.100.101 12600kf.et.net A +time=3 +tries=1 +noedns
```

输出:

```text
;; Got answer:
;; ->>HEADER<<- opcode: QUERY, status: NOERROR
;; flags: qr aa rd
;; WARNING: recursion requested but not available

;; ANSWER SECTION:
12600kf.et.net. 1 IN A 10.126.126.4

;; SERVER: 100.100.100.101#53(100.100.100.101) (UDP)
```

### 重现步骤 / Reproduction Steps

1. 在 Ubuntu 22.04 Docker 环境中启动 EasyTier，配置 `accept_dns = true`。
2. 使用 DHCP 自动分配 EasyTier 虚拟 IP。
3. 在 host 上通过 `systemd-resolved` 设置 split DNS，只让 `*.et.net` 走 `100.100.100.101`。
4. 确认正常状态：
   ```bash
   dig @100.100.100.101 qq.com A +time=1 +tries=1 +noedns
   dig @100.100.100.101 redmi.et.net A +time=1 +tries=1 +noedns
   ping -c 5 -i 1 -W 2 100.100.100.101
   ping -c 5 -i 1 -W 2 10.126.126.3
   ```
5. 正常时结果：
   - `100.100.100.101` 延迟约 0.2ms；
   - `10.126.126.3` 延迟约 4~8ms；
   - Magic DNS 正常返回。
6. 运行一段时间后，再次执行：
   ```bash
   dig @100.100.100.101 qq.com A +time=3 +tries=1 +noedns
   dig @100.100.100.101 redmi.et.net A +time=3 +tries=1 +noedns
   ping 100.100.100.101
   ping redmi.et.net
   ```
7. 异常时表现：
   - `dig @100.100.100.101` 超时；
   - `ping 100.100.100.101` 出现几十秒到上百秒延迟；
   - `ping redmi.et.net` 也出现几十秒延迟；
   - `tcpdump -ni tun0 host 100.100.100.101 and port 53` 可以看到 DNS 请求发出，但没有响应；
   - 容器 CPU/内存很低；
   - `tun0` 没有 errors/dropped；
   - EasyTier 日志中没有明显 peer disconnect/error。
8. 执行：
   ```bash
   docker restart 1Panel-easytier-kGFb
   ```
9. 重启后立即恢复：
   - `ping 100.100.100.101` 回到 0.2ms 左右；
   - `ping redmi` 回到 4~8ms；
   - Magic DNS 立即恢复。

### 预期结果 / Expected Behavior

即使某个 peer 链路不稳定，EasyTier 也不应该让本机 `100.100.100.101` 的 Magic DNS 或整个 TUN 数据面出现几十秒到上百秒延迟。

如果内部队列、peer、tunnel 或转发状态异常，期望 EasyTier 可以：

- 自动恢复；
- 丢弃过期包；
- 重建异常 peer/tunnel；
- 或至少在日志中输出明确错误。

而不是必须手动重启容器后才能恢复。

### 额外信息 / Additional Context

当前判断不像普通 DNS 配置错误，原因：

1. `systemd-resolved` split DNS 已验证可正常工作；
2. 异常时直接查询 `100.100.100.101` 也会超时；
3. 异常时 `ping 100.100.100.101` 延迟会逐渐增长到几十秒甚至上百秒；
4. 容器资源占用很低；
5. `tun0` 没有 dropped/errors；
6. 重启 EasyTier 容器后立即恢复。

怀疑方向：

- EasyTier Magic DNS responder 卡住；
- TUN 数据面内部队列阻塞；
- TCP tunnel head-of-line blocking；
- `latency_first` 选路状态异常；
- Docker TUN 环境下的某个数据面问题；
- 100.100.100.101 本地虚拟 DNS 地址受 peer/route 状态影响；
- peer/tunnel 异常但日志没有明显输出。

**Comment by KKRainbow** [comment]
“运行一段时间后” 是运行多久，中间做了什么操作。出问题的时候 easytier 的 cpu 占用有无异常。出问题时可否通过 cli 开启 et 日志
