### ISSUE TITLE
[bug] enable_kcp_proxy 绕过 proxy_forward_by_system，导致 TCP 源端口被改写

### ISSUE THREAD

**Issue by SakuraPuare** [EasyTier/EasyTier#2504]
### 问题简要描述 / Brief Description

同时设置 `proxy_forward_by_system = true` 和 `enable_kcp_proxy = true` 时，经 `proxy_networks` 转发的 TCP 包的**源端口和序列号仍被改写**。KCP wrapped transport 模块（`WrappedTransportProxyModule`）完全忽略 `proxy_forward_by_system` 标志，在 NIC pipeline 中拦截 TCP SYN，比正常的内核转发路径更早介入。

期望行为：`proxy_forward_by_system = true` 应保证所有 proxy_networks 流量在 IP 层透明转发，包到达目的端时保留原始源端口和 TCP 序列号。

实际行为：KCP source filter（`WrappedTransportSourceFilter`）拦截发往通告 `kcp_input=true` 的对端的 TCP SYN，在用户态 smoltcp 栈中终结 TCP 连接，通过 KCP stream 中继数据。目的端模块用 `connect("0.0.0.0:0", dst)` 重新建立连接，源端口被随机分配、序列号完全改变。

---

### 环境信息 / Environment Information

**EasyTier 版本:** 2.6.4-0b27ac28

**网络拓扑:**
- 节点 A (172.22.0.100): Linux, NAT VPS (PortRestricted NAT), 单节点 k3s
- 节点 B (172.22.0.200): Linux, NAT VPS (PortRestricted NAT), k3s 集群
- 隧道: TCP P2P 直连（无 relay）
- 节点 B 通告 `proxy_networks = ["10.43.0.0/16"]`（Kubernetes Service CIDR）
- 节点 A 发 TCP 到 10.43.0.10:53（节点 B proxy_networks 中的 ClusterIP）

---

### 节点配置 / Node Configurations

**节点 A（发送端）:**
```toml
instance_name = "node-a"
ipv4 = "172.22.0.100/16"
enable_kcp_proxy = true

[flags]
proxy_forward_by_system = true

[[peer]]
uri = "tcp://node-b.example.com:11010"
```

**节点 B（接收端）:**
```bash
easytier-core -c config.toml \
  --proxy-networks 10.43.0.0/16 \
  --proxy-forward-by-system
```
- 未设置 `disable_kcp_input`（默认 false）

---

### 日志信息 / Log Information

无错误日志，行为完全静默。通过两端 tcpdump 诊断：

**节点 A tun0（出站 SYN）:**
```
IP 172.22.0.100.55557 > 10.43.0.10.53: Flags [S], seq 708943111
```
源端口 = **55557**

**节点 B tun0（入站 — 经 EasyTier 隧道后）:**
```
IP 172.22.0.100.11637 > 10.43.0.10.53: Flags [S], seq 3992103609
```
源端口 = **11637**（被改了！），seq 也变了

**对照实验 — 直连 mesh IP（不经过 proxy_networks 路径）:**
```
IP 172.22.0.100.55555 > 172.22.0.200.30053: Flags [S], seq 1161334138
→ 节点 B 收到端口 55555 不变，三次握手正常完成
```

**关闭 `enable_kcp_proxy` 后对照：** 同一路径端口不再被改写，TCP 连接正常建立。

---

### 重现步骤 / Reproduction Steps

1. 节点 A 配置 `enable_kcp_proxy = true` + `proxy_forward_by_system = true`
2. 节点 B 配置 `--proxy-networks 10.43.0.0/16 --proxy-forward-by-system`，不设 `disable_kcp_input`
3. 两节点建立 P2P 隧道
4. 节点 A 执行：`nc -p 55557 10.43.0.10 53`
5. 同时在两端 tun0 抓包
6. 观察：源端口在两次抓包间发生变化

---

### 预期结果 / Expected Behavior

`proxy_forward_by_system = true` 时，proxy_networks 流量应在 IP 层透传（TUN → 隧道 → 远端 TUN → 内核路由），保留所有 TCP 头字段。`enable_kcp_proxy` 不应覆盖此行为。

---

### 额外信息 / Additional Context

**源码分析：**

- `proxy_forward_by_system` 通过 `GatewayServiceConfig::should_start()`（`gateway.rs:61-67`）仅控制 `CoreProxyModule`
- `WrappedTransportProxyModule` 在 `lifecycle.rs:128` 无条件启动，仅由 `enable_kcp_proxy` 控制
- 两模块完全独立，`forward_by_system` 对 KCP 路径无影响
- 目的端 `wrapped_transport_destination.rs:295` 用 `connect("0.0.0.0:0", dst)` 重建连接

**建议修复：**

在 `WrappedTransportSourceFilter::try_process_wrapped_tcp_packet_from_nic()` 中检查 `forward_by_system`：

```rust
if ctx.forward_by_system {
    return false;
}
```

**Workaround：** 源端关闭 `enable_kcp_proxy`，或目的端设置 `disable_kcp_input = true`。

**影响：** 跨集群场景（Kubernetes ClusterIP/kube-dns 等）使用 `proxy_forward_by_system` + `enable_kcp_proxy` 时，proxy_networks 流量因源端口改写导致 conntrack 无法匹配回程包，TCP 连接建立失败。

**Comment by KKRainbow** [comment]
kcp proxy 是源端拦截流量，转成 kcp 发到目的端，目的端的系统栈压根不认识 kcp 流量，转回 tcp 后必然要改写 ip，你的需求只能通过关闭 kcp proxy 实现。
可以参考这个原理图：https://easytier.cn/guide/network/kcp-proxy.html#%E7%BD%91%E7%BB%9C%E6%8B%93%E6%89%91
